alabel,message
legitime," From synesthetic poems to questioning poems to the ghazal, Lightning Paths: 75 Poetry Writing Exercises has something fun or fascinating for every student and teacher as they explore the possibilities of poetry writing. The exercises teach and utilize technique while also focusing on and inspiring the intuitive and imaginative qualities of poetry. Each poem type includes an introduction explaining the exercise’s goal, detailed instructions, and a student example. The 75 activities are divided into three sections: exercises that focus on different types of imagery and ways to generate fresh imagery; exercises born out of unusual prompts and ideas that engage a writer’s experiences in the real world; and exercises related to what form might look like or how it might function. "
legitime," From the Southern California deserts to the Sierra Nevada to the vineyards and movie sets and architectural landmarks left by modern mortals, little of the state has been left unscathed by wildfire. In the past several years, infernos have scorched the Yosemite Valley, blackened the Joshua Tree National Park’s palm-strewn Oasis of Mara, damaged the Paramount Ranch and eviscerated Malibu summer camps beloved for generations. "
legitime," From this moment I have been blessed I live only for your happiness And for your love I’d give my last breath From this moment on  I give my hand to you with all my heart I can’t wait to live my life with you I can’t wait to start You and I will never be apart My dreams came true because of you "
legitime," From what we can tell, these are usually criminal organizations that work together. And once a victim becomes a victim, in that they send money, they will oftentimes be placed on what’s called a “sucker list.” And their names and identities are shared with other criminals. And they will be targeted for future recruitment.  I always tell people, when we try to spread the word, if you don’t know somebody, don’t send them money. Try to research that person’s profile that you’re getting involved with, and try to do some due diligence. But, you know, we’re all human. We all make mistakes. And I just hope victims who have fallen prey to this can learn and hopefully not enter into another scam. We have seen victims become victimized again. So I just ask that victims try to learn from the experience and try to share their experience with others so that other people can learn from their experience and not become victimized as well. "
legitime," Funny how we both end up here but everything seems so right I wonder what would happen If we went back and put up a fight ‘Cause once upon a time you were my everything It’s clear to see that time hasn’t changed a thing So what in this world do you think could ever take you off my mind (take you off my mind) "
legitime," Ghana has recently joined the ranks of oil-producing states with a projected output of 120,000 barrels per day. This has greatly elevated hopes among the general public, but also sparked fears of a ‘Nigerian scenario’ in which oil becomes a problem rather than a solution. This article argues that Ghana, as a latecomer to the oil industry, may possess a structural immunity against the natural resource curse. The argument centres on three main factors: the country's stable political system, its relatively robust and diversified economy, and the strength of civil society. As a result, the usual symptoms linked to oil extraction across the developing world are unlikely to turn the country upside down. Instead, we suggest that the ‘curse’ should be perceived as a treatable ‘disease’. The article pursues this analogy by showing that, since the discovery of oil, Ghana has been strengthening its ‘immune system’ through a new legal framework, improvements in transparency and accountability, and modest attempts to strengthen non-resource sectors of the economy. "
legitime," Haters that live on the internet Live in my head, should be paying rent I’m way too good at listening All these comments fucking up my energy "
legitime," Heart beats fast Colors and promises How to be brave? How can I love when I’m afraid to fall? But watching you stand alone, All of my doubt suddenly goes away somehow.  I have died every day waiting for you Darling, don’t be afraid I have loved you For a thousand years I’ll love you for a thousand more. "
legitime," Heart beats fast Colours and promises How to be brave? How can I love when I’m afraid to fall? But watching you stand alone All of my doubt Suddenly goes away somehow "
legitime," Here in the Bay Area, we are fortunate to have good-standing working relationships with a number of companies, including Uber, as the U.S. Attorney mentioned. These relationships help the flow of information and allow us to pursue bad actors and assist companies in their recovery from data breaches.  We encourage companies to develop a relationship with the FBI and local law enforcement prior to an incident, and incorporate us into their incident response plans. We are working to get ahead of the threat and be predictive in the way we approach cybersecurity. We cannot impose consequences on our cyber adversaries if companies do not step forward and provide us with evidence of an intrusion, and no one will come forward if they think that all that will come from it is shame. "
legitime," Here, making each day of the year, changing my life with a wave of her hand. Nobody can deny that there's something there All your insecurities, all the dirty laundry never made me blink one time. "
legitime," Here's to you, the one that always pulls us through, always do what you gotta do. You're one of a kind. Thank God you're mine. How sweet it is to be loved by you "
legitime," his article sheds new light on the migration of Africans to the European Union by looking at how spatial mobility relates to migrant morality, informed by in-depth qualitative interviews with members of the Ethiopian Orthodox Church in Paris. Although issues such as discrimination and exclusion are salient features of contemporary migration, the process of migration across space in the ‘age of borders’ also forces migrants to appraise their shared moral values and ethical standards. Using migrant morality as an entry point, the article demonstrates how borders define migrant lives, irrespective of their legal status. The process of negotiating these borders leads to profound experiences of self-doubt, the testing and alteration of gender relations, and processes of self-evaluation and ethical self-fashioning that serve in both shaping migrant life as well as in producing forms of resistance. The article reveals how migrants are embedded in multi-layered experiences that are simultaneously personal, social, spiritual, and political. "
legitime," Hit me like a ray of sun burning through my darkest night. You're the only one that I want. Think I'm addicted to your light. "
legitime," How can you migrate your tried and true face-to-face teaching practices into an online environment? This is the core question that Scott Warnock seeks to answer in Teaching Writing Online: How and Why. Warnock explores how to teach an online (or hybrid) writing course by emphasizing the importance of using and managing students’ written communications. Grounded in Warnock’s years of experience in teaching, teacher preparation, online learning, and composition scholarship, this book is designed with usability in mind. Features include: More than just the latest trend, online writing instruction offers a way to teach writing that brings together theoretical approaches and practical applications. Whether you are new to teaching writing online or are looking for a more comprehensive approach, this book will provide the ideas and structure you need. "
legitime," How dare you  Have lips like that How dare you  Gon’ kiss like that  How dare you  Make us a fact  Uh uh uh  "
legitime," However far away I will always love you However long I stay I will always love you Whatever words I say I will always love you I will always love you "
legitime," However far away I will always love you However long I stay I will always love you Whatever words I say I will always love you I will always love you  Whenever I’m alone with you You make me feel like I am free again Whenever I’m alone with you You make me feel like I am clean again I’ll always love you I’ll always love you ‘Cause I love you Love, love, love… "
legitime," I could make you happy, make your dreams come true Nothing that I wouldn’t do Go to the ends of the Earth for you To make you feel my love To make you feel my love "
legitime," I do swear that I’ll always be there I’d give anything and everything and I will always care Through weakness and strength, happiness and sorrow, for better for worse, I will love you with every beat of my heart "
legitime," I don’t need a lot of things, I can get by with nothing Of all the blessings life can bring, I’ve always needed something But I’ve got all I want When it comes to loving you You’re my only reason, You’re my only truth. "
legitime," I don’t wanna wait in vain for your love; I don’t wanna wait in vain for your love. From the very first time I rest my eyes on you, girl, My heart says follow t’rough. But I know, now, that I’m way down on your line, But the waitin’ feel is fine: So don’t treat me like a puppet on a string, ‘Cause I know I have to do my thing. Don’t talk to me as if you think I’m dumb; I wanna know when you’re gonna come – soon. "
legitime," I drank too much last night, got bills to pay my head just feels in pain I missed the bus and there’ll be hell today I’m late for work again and even if I’m there, they’ll all imply that I might not last the day and then you call me and it’s not so bad it’s not so bad and "
legitime," I feel wonderful because I see the love light in your eyes. And the wonder of it all is that you just don't realize...how much I love you. My heart's been borrowed and yours has been blue; all's well that ends well to end up with you. "
legitime," I found a dream, that I could speak to A dream that I can call my own I found a thrill to press my cheek to A thrill that I have never known "
legitime," I gave you all the love I got I gave you more than I could give I gave you love I gave you all that I have inside And you took my love You took my love Didn’t I tell you What I believe Did somebody say that A love like that won’t last Didn’t I give you All that I’ve got to give baby "
legitime," I hate your touch I hate your mouth I can't stand every single word that falls out But you're all that I've been dreaming of This is not another song about love I hate your voice I hate your lips I hate how bad I wanna steal your kiss But you're all that I've been dreaming of This is not another song about love "
legitime," I have a friend who’s a ridiculously gifted singer, but I’m not sure if she’s aware of it. She’s a theatrical soprano with a vocal range that’s out of this world. With a degree in music and teaching, she truly loves what she does, but something has stopped her from moving forward over the years. It’s her lack of belief in herself, and I sense that she doesn’t feel she deserves the creative fulfillment she longs for. This is something she needs to work past, but what’s also hurting her is her resentment of others who are putting themselves out there. “Oh my gosh, she’s so off key,” she quietly griped to me when we stopped at a trendy lounge to hear a jazz quartet led by a sultry singer. “I would sing it better!” "
legitime," I have died every day waiting for you Darling, don’t be afraid I have loved you for a thousand years I’ll love you for a thousand more "
legitime," I hope life treats you kind And I hope you have all you’ve dreamed of And I wish you joy and happiness But above all this I wish you love  And I… will always love you I will always love you I will always love you I will always love you "
legitime," I hope you don't mind that I put down in words how wonderful life is while you're in the world. "
legitime," I keep crying I keep trying for you There’s nothing like you and I baby  This is no ordinary love No ordinary Love This is no ordinary love No ordinary Love "
legitime," I keep on fallin’ In and out of love With you Sometimes I love ya Sometimes you make me blue Sometimes I feel good At times I feel used Lovin you darlin’ Makes me so confused I keep on Fallin’ In and out of love with you I never loved someone The way that I love you "
legitime," I keep on Fallin’ In and out of love with you I never loved someone The way that I love you  Im fallin’ In and out of love with you I never loved someone The way that I love you  Im fallin’ In and out of love with you I never loved someone The way that I love you "
legitime," I know you haven’t made your mind up yet But I will never do you wrong I’ve known it from the moment that we met No doubt in my mind where you belong "
legitime," I know you haven't made your mind up yet Bu't I will never do you wrong I've known it from the moment that we met No doubt in my mind where you belong "
legitime," I look and stare so deep in your eyes/I touch on you more and more every time When you leave, I'm begging you not to go/Call your name two or three times in a row Such a funny thing for me to try to explain/How I'm feeling and my pride is the one to blame 'Cause I know I don't understand/Just how your love can do what no one else can "
legitime," I love lying next to you I could do this for eternity You and me – we’re meant to be In holy matrimony God knew exactly what he was doing When he led me to you "
legitime," I love you Is all that you can’t say Years gone by and still Words don’t come easily Like I love you, I love you  But you can say baby Baby can I hold you tonight Maybe if I told you the right words At the right time, you’d be mine. "
legitime," I used to be so happy But without you here I feel so low I watched you as you left but I can never seem to let you go ‘Cause once upon a time you were my everything It’s clear to see that time hasn’t changed a thing It’s buried deep inside me but I feel there’s something you should know "
legitime," I used to think maybe you love me, now baby I'm sure And I just can't wait till the day when you knock on my door... I'm walking on sunshine (Wow!) I'm walking on sunshine (Wow!) And don't it feel good "
legitime," I want to thank you for giving me the best day of my life Oh just to be with you is having the best day of my life  Push the door, I’m home at last and I’m soaking through and through then you handed me a towel and all I see is you and even if my house falls down now, I wouldn’t have a clue because you’re near me and  I want to thank you for giving me the best day of my life Oh just to be with you is having the best day of my life "
legitime," I was made for loving you Even though we may be hopeless hearts just passing through Every bone screaming I don't know what we should do All I know is, darling, I was made for loving you "
legitime," I will never forget you You’ll always be by my side From the day that I met you I knew that I would love you ’til the day I die And I will never want much more And in my heart I will always be sure I will never forget you And you will always be by my side ’til the day I die "
legitime," I’d go hungry; I’d go black and blue I’d go crawling down the avenue No, there’s nothing that I wouldn’t do To make you feel my love "
legitime," I’ve got sunshine on a cloudy day When it’s cold outside, I’ve got the month of May I guess you’d say What can make me feel this way?  My girl, my girl, my girl Talkin’ ’bout my girl My girl. "
legitime," I’ve seen the world Done it all Had my cake now Diamonds, brilliant And Bel Air now Hot summer nights, mid July When you and I were forever wild The crazy days, city lights The way you’d play with me like a child "
legitime," I’ve seen the world, lit it up As my stage now Channeling angels in the new age now Hot summer days, rock ‘n’ roll The way you play for me at your show And all the ways I got to know Your pretty face and electric soul "
legitime," If I ain't got nothing. I got you If I ain't got something I don't give a damn, 'cause I got it with you I don't know much about algebra, but I know one plus one equals two And it's me and you That's all we'll have when the world is through "
legitime," If I had to live without you What kinda life it would be Oh I need you in my arms, need you to hold  You are my world, my heart, my soul "
legitime," If tomorrow is judgment day And I’m standing on the front line And the Lord asks me what I did with my life I will say I spent it with you. "
legitime," If you should ever leave me—though life would still go on, believe me—the world could show nothing to me, so what good would living do me? God only knows what I'd be without you. "
legitime," I'll be the weeping willow drowning in my tears, and you can go swimming when you are here. I'll be the rainbow after the tears are gone, wrap you in my colors and keep you warm. "
legitime," I'll get back to them on this.  I know we have sent financials to Clinton Energy...I'll check to see if this is enough.  In the meantime, is it possible to show me indications on the quotes I asked for?  Please advise. George       Can you please call my credit desk at 713-853-1803.  They have not received any financials for ACN Power.  Thanks,  Phillip Allen "
legitime," I'll never forget you/You'll always be by my side From the day that I met you/I knew that I would love you 'til the day I die And I will never want much more/And in my heart I will always be sure I will never forget you/And you'll always be by my side 'til the day I die "
legitime," I'm seeing the pain, seeing the pleasure Nobody but you, 'body but me 'Body but us, bodies together I love to hold you close, tonight and always I love to wake up next to you I love to hold you close, tonight and always I love to wake up next to you "
legitime," I'm the kind of person who endorses a deep commitment Getting comfy getting perfect is what I live for But a look and then a smell of perfume It's like I'm down on the floor And I don't know what I'm in for Conversation has a time and place in the interaction Of a lover and a mate but the time of talking Using symbols, using words can be likened To a deep sea diver who is swimming with a raincoat "
legitime," In my life there's been heartache and pain I don't know if I can face it again Can't stop now, I've traveled so far, to change this lonely life I want to know what love is, I want you to show me I want to feel what love is, I know you can show me "
legitime," In some situations the victim may be unknowingly recruited as a “money mule”: someone who transfers money illegally on behalf of others. Actors groom their victims over time and convince them to open bank accounts under the guise of sending or receiving funds. Grooming is defined as preparing a victim to conduct fraudulent activity on their behalf through communications intended to develop a trust relationship. These accounts are used to facilitate criminal activities for a short period of time. If the account is flagged by the financial institution, it may be closed and the actor will either direct the victim to open a new account or begin grooming a new victim.  In other situations, the actor claims to be a European citizen or an American living abroad. After a few months of developing trust, the actor will tell the victim about a lucrative business opportunity. The actor will inform the victim there are investors willing to fund the project, but they need a U.S. bank account to receive funds. The victim is asked to open a bank account or register a limited liability company in the victim’s name and then to receive and send money from that account to other accounts controlled by the actor.  "
legitime," In the nationwide debates in the build-up to the Ghana elections of December 2016, the New Patriotic Party, then in the opposition, claimed that 76,000 individuals were registered on both the Togolese and the Ghanaian voters’ registers, casting doubt on the citizenship status of voters who crossed the border from Togo to vote in Ghana. The issues that political parties continually raise about the voters’ register result in recurrent debates about identification documents and belonging. This article poses the underlying questions that many election analyses overlook: who is the electorate? Who decides who belongs to the nation? I argue that the criteria for belonging are neither those that are set in the law, nor those that seem to be suggested by political parties, but those that are decided at a local level where communities are the real gatekeepers of the vote. This article contributes to the literature on elections in Africa by highlighting the porosity of borders in a mobile world, not purely in terms of electoral outcomes, but in terms of broader issues about citizenship and belonging. "
legitime," In Washington, D.C., the news from the park hit Mr. Young like “a gut punch.” Now 59, he was 7, he said, when he first visited Big Basin on a trip with his father, Warren. He remembered his father buying him a pocketknife, teaching him to camp and helping him build a fire. "
legitime," It's you love It just does something to me It sends a shock right through me I can't get enough And if you wonder About the spell I'm under Oh it's your love "
legitime," I've been waitin' for you/It's been so long I knew just what I would do/When I heard your song You filled my heart with a kiss/You gave me freedom You knew I could not resist/I needed someone And now we're flyin' through the stars/I hope this night will last forever Oh oh oh oh, ain't nobody loves me better "
legitime," Keep on lovin’ you Through the I take it backs… I didn’t mean it like thats I’d never hurt yous… Oh, I keep on lovin’ you  I keep on lovin’ you… I keep on lovin’ you Through the I take it backs… I didn’t mean it like that I’d never hurt yous… Oh, I keep on lovin’ you I keep on lovin’ you… I keep on lovin’ you "
legitime," Ken Lindblom and Leila Christenbury return with the second volume in the Continuing the Journey series, this time focusing on authentic writing instruction for middle and high school classrooms. The authors draw on what research has taught them about writing—concepts deeply rooted in personal identity and real-world experience—and why we must teach writing accurately, effectively, and fearlessly. As in the previous volume, the book includes visits to an ideal Teachers’ Lounge, featuring highly experienced colleagues and well-known researchers in English teaching. Topics covered include responding to student writing, handling the paper load, teaching grammar and usage in the context of writing, and seeking real-world feedback. "
legitime," Kiss me down by the broken tree house Swing me upon its hanging tire Bring, bring, bring your flowered hat We’ll take the trail marked on your father’s map "
legitime," Kiss me out of the bearded barley/Nightly, beside the green, green grass Swing, swing, swing the spinning step/You'll wear those shoes and I will wear that dress Oh, kiss me beneath the milky twilight/Lead me out on the moonlit floor Lift your open hand/Strike up the band, and make the fireflies dance Silvermoon's sparkling/So kiss me "
legitime," Let it out Been building up I better let it out Say everything I've been meaning now Dreaming bout I need it now I need it now I need your touch I have no doubt I want your love till it all runs out Cause you're all I've been dreaming of Is this just another song about love? I need your voice I need your lips I need you bad I wanna steal your kiss Cause you're all that I've been dreaming of This is just another song about love "
legitime," Let it out Been building up you better Let it out Say everything you've been meaning now I want it to burn When you tell me I'm such a wreck It isn't easy cleaning up your mess It's like a garter up around my neck she says it won't hurt "
