alabel,message
illegitime,– beautiful -sexy – sensual – and all the good stuff. You my dear put a smile on my face everyday !!!!!!!!!!!!! LOL on my face everyday !!!!!!!!!!!!! LOL Thank-You for your unconditional Love Thank-you for accepting me for me Thank-you for accepting where I am in my life today Thank-you for accepting Love from Me to You Thank-you for accepting to be there for me Thank-you for being You Thank-you for wanting to move in with me Thank-you for pausing to read my profile Thank-you for your Trust Thank-you for your Faith Thank-you for your loyalty Thank-you for your sweet words in your e-mails Thank-you for your sweet words on the phone
illegitime," Thank-you for opening your Heart to Love again Thank-you for making Love in the shower Thank-you for making Love in the pool Thank-you for making Love in the Hot Tub Thank-you for making Love anywhere & everywhere LOL Thank-you for going shopping with me Thank-you for your equal partnership Thank-you for being my second half Thank-you for being my Better half Thank-you for the expertise you bring to them Thank-you for your encouragement to walk into the future Thank-you for allowing me always open the car door for you Thank-you for the beautiful wedding suite Thank-you for our beautiful wedding"
illegitime,[Kian:] So here we stand In our secret place With a sound of the crowd So far away And you take my hand And it feels like home We both understand It’s where we belong [Bryan:] So how do I say? Do I say goodbye? We both have our dreams We both wanna fly So let’s take tonight To carry us through The lonely times [CHORUS:] [All:] I’ll always look back As I walk away This memory Will last for eternity And all of our tears Will be lost in the rain When I’ve found my way Back to your arms again But until that day You know you are The queen of my heart [Bryan:] Queen of my heart [Shane:] So let’s take tonight And never let go While dancing we’ll kiss Like there’s no tomorrow As the stars sparkle down Like a diamond ring I’ll treasure this moment Till we meet again [Mark: (All:)] But no matter how far (Matter how far) Or where you may be (Where you may be) I just close my eyes (I just close my eyes) And you’re in my dreams And there you will be Until we meet [Repeat chorus twice] [Shane: (All:)] Oh yeah
illegitime,"“I smiled to many people for more than a billion times; but when I first found you, my heart took over and smiled for the first time.” … This is how much I knew it is you I have been searching for all my life. “Your presence in my life brings wonderful smiles and loving thoughts within my heart.” … And so shall it be until the end of time “To love is to place our happiness in the happiness of another.” … That we are happy together is all I ever wanted and will ever want for the rest of my life “Kiss slowly, love deeply, forgive quickly. Life is too short for you to be disappointed any longer.” … I promise on my life honey… I promise to love you endlessly and our secrets shall always remain our secrets not to reveal to any other person; only between you and I “Just when I thought that love could never be a part of me, that’s when you came along and showed me happiness!” … Thank you for your endless love and I’m so happy we both appreciate every moment of our relationship since we found each other."
illegitime,"46 REASONS WHY I LOVE YOU. 1. I love the way we finish each others sentences. 2. I love the way I know you’ll never give up on me. 3. I love the fact that I wouldn’t ever give up on you. 4. I love how beautiful your eyes are. 5. I love the way I can’t imagine a day without you in my life. 6. I love the way if we were ever separated I wouldn’t know how to go on. 7. I love how I know you’ll always be there when I need you to be. 8. I love the fact that I will always be there for you too. 9. I love how when I dream of my life partner, the only person that I can see is you. 10. I love how complete I feel when I am with you. 11. I love the way you sometimes make me laugh. 12. I love the way you sometimes laugh. 13. I love your thoughtfulness. 14. I love your tenderness. 15. I love your ability to speak without saying a single word. 16. I love the way, how even though we may be miles apart I still feel like you’re right here with me. 17. I love the way you surprise me with the perfect emails that show you pay attention to me. 18. I love your love for the things that interest me. 19. I love the way you let me live my life freely without jealousy. 20. I love how you demand respect but are not controlling. 21. I love how I would do anything in this world to make you happy. 22. I love how you would do anything in this world to make me happy. 23. I love the way your voice sounds over the phone. 24. I love the way your voice sounds when you whisper sweet nothings in my ear. 25. I love the completeness and oneness I feel when I think of us making love. 26. I love your sensuality. 27. I love how our romance feels like the perfect romance movie. 28. I love how you are my soul mate. 29. I love the way you handle troubled times. 30. I love the way you respect me. 31. I love the way you protect and defend me. 32. I love when I imagine the softness of your lips against mine. 33. I love when I imagine the softness of you lips against my body. 34. I love when I imagine the feeling of your hair brushing against me when we make love. 35. I love when I imagine us laying in bed at night talking about nothing. 36. I love when I imagine us waking up to find we’ve been cuddling together all night. 37. I love the surprises you leave for me. 38. I love your intelligence. 39. I love your ingenuity. 40. I love your love for life. 41. I love your passion for your hobbies and interests. 42. I love how every time I look at your picture, you take my breath away. 43. I love how I thank God everyday for bringing someone as wonderful as you into my life. 44. I love the fact you gave me the gift of life. 45. I love the special moments that we shared that will remain my fondest memories of you and I. 46. I love you for you. Sweetheart, you mean life to me. THANK YOU SO MUCH LOVE. I CAN’T WAIT FOR US TO BEGIN OUR NEW LIVES TOGETHER!!! LONG KISSES AND HUGS"
illegitime,"A life full of joy A life full of happiness A special sweetness that never ends Certainly it is our destiny To be together till eternity You cannot imagine how much I hate to say this But I know it’s all good That I go out now and get the doors changed Good morning sweetest of souls! Please enjoy your day. Love ya! PS- I’ll call you and let you know when I get my payment. I am more than happy my love, you just can’t imagine! Thank you for every thing and I promise to refund all your money soon."
illegitime,"A POEM FOR YOU I NEED YOU MORE… THE FIRST TIME I SAW YOUR FACE, EVEN THOUGH IT WAS IN THE PICTURE I THOUGHT THE SUN ROSE IN YOUR EYES AND THE MOON AND THE STARS WERE THE GIFT YOU GAVE ME THE FIRST TIME EVER I KISSED YOUR MOUTH EVEN THOUGH IT WAS ON THE SCREEN OF MY SYSTEM, I FELT THE EARTH WOULD TURN IN MY HAND THE FIRST TIME EVER I LAY WITH YOU, EVEN THOUGH IT WAS IN MY DREAM, I FELT YOUR HEART CLOSE TO MINE AND I KNEW OUR JOY WOULD FILL THE EARTH AND WOULD LAST TILL THE END OF THIS WORLD FOR ALL THOSE TIME YOU OPENED MY EYES AND ALL THE TRUTH YOU MADE ME SEE FOR ALL THE JOY YOU BROUGHT TO MY LIFE FOR ALL THE LOVE I FOUND IN YOU"
illegitime,"Absolutely I have come to know that we spend most of our life seeking for the secondary needs, while our primary needs are left unseen. We have worked so hard and attained some wealth right? But for what purpose? To be realistic, except if you just want to be known as a rich person, wealth means nothing if you have no best friend to share it with. All the millions are useless indeed. How much do we need to eat? How much do we need for shelter? How much do we need for daily fun? Excess and excess leads us to vanity. But for few of us who value the simplicity, we sure would do well in finding happiness. As I always say, money can buy a good bed, but never will money buy sleep; It can buy the best diamond watch, but can never buy time; it can buy piles of books, but cant buy knowledge; it can buy food, but not satisfaction; MONEY can buy sex, but can NEVER buy love. That is why I refuse to follow the crowd. So as my own man, I would give up all that can be bought for that which cant be bought. I want true joy and happiness. I want my woman to have power over my moods."
illegitime,"After reviewing the whole work, they questioned the difference in doors and I tried to explain every thing, hoping they would comprehend but instead, they brought out our agreement, reminded me of what I promised to use and never to default. I spent time trying to make them understand that it was the market cost of these things that dragged me into such decision but yet, they wouldn’t comprehend. I again asked if they could pay a part of my money and the question that followed was, ‘sir Ben Gold, why are we paying you $30Million if we need someone to use our own money to execute the project?’ I told them I really do understand they are paying three times my invested capital but as the situation is, I would need few thousands to change the doors. We argued over this for long and at a point in time, they almost got incensed with my explanation and concluded they only came with my check as issued from the head quarter in Dubai and no way for them to pay a part of the money. They also advised that I get the job done as quickly as possible so I don’t get penalized for long delay."
illegitime,"An adult with an open-heart. A man who puts a smile on your face everyday. I will be that man who’s there for you just as you’re there for me, the one who encourages you through life’s ups and downs. But ultimately, I want to be the man who is your everything. Not a second goes by that I don’t think about you. You have brought so much joy to my life and you give me so much to look forward to when I wake up every morning. I want you to know that I sincerely appreciate you and I can never tell you enough that “I LOVE YOU!” Already you got my head swollen and my stomach full of butterflies. You make me feel like entering into these words and just come out from your computer when you log on into your email to check this message. I really need to exercise myself enough to receive all the hugs awaiting me. I wonder what to call you my love, I think you are the number one criminal in the world. You are a perfect ‘heart robber’ for stealing all my heart without leaving even a space for me. How wonderful you are my heart robber! LOL. Please take good care of yourself and have a splendid day. Thinking of you~~~~~~~~~~~~~~ XOXOXOXOXOXOX"
illegitime,Anyone can be cool but awesomeness like yours takes practice.
illegitime,"Are you a God fearing woman? I am a God fearing man, I do have my Christian faith to credit for my life, attitude and success; however, I don't use the name of God to attract women for my character speaks for itself. I am not the type of man who is focused entirely on himself."
illegitime,Are you a left or right handed person? I am a right handed person
illegitime,"Are you a sports fan? And what are your favorite sports? I have a passion for sports and my favorite sport is football and I also like Sea Fishing, kayaking, boating, sailing are my sports of choice. I’m not afraid to speak my mind, trust my gut, and follow my heart. Even if it gets me in trouble...lol"
illegitime,"Are you financially stable? Yes of course I am financially stable, I do receive a high income from my Job so there's no need for me to be afraid of any financial situation."
illegitime,"Are you willing to relocate if you find your soul mate? For me it depends on my soul mate; If she willingly wants me relocate to Her Home, its okay with me, but if she likes to relocate to my Home that will be fine so long as we stick together as ONE, Perhaps she might want us to Buy another Home, it fine as long as she's the happiest Woman on Earth"
illegitime,"As regards all our conversation, the things we have known about each other, the lovely pictures, I make bold to say, ‘I love you!’ I want you to look at those pictures of ours, do you ever think any other person could match us? My answer is NO! We are created for each other. No matter who we are, no matter how stone hearted we may be, every human being knows what they feel immediately they see the opposite sex, be it in the picture or physically. If you feel just likeness for someone, you know. If you feel like having sex with someone, you know. If you feel you want someone to be yours forever, you also know. All these feelings are our bodies telling us what they want. But instead of most people giving their bodies and spirit what they want, they tend to give them bad food, I mean bad partners. And you know, the bodies will reject them either immediately or someday. You might have been through a terrible past just like me, but it shouldn’t destroy our yet to come, beautiful future. Because, if we close our eyes and wait for all the bad people of this world to pass by, the good ones will also pass and we won’t notice."
illegitime,"At that point, what he was saying wasn’t what I wanted to hear so I just grabbed my check from him and walked out. I went on to another different bank and on to another one and on to another one and on to five different banks and I heard the same statement. Dear, you can’t imagine how I was sweating inside air condition. I felt so sad and so I decided to go and see the ticketing agent who booked my flight. since I was not having a dime to pay him, I had to sit at his office and explain my situation to him. I never told him of the check I got because I don’t trust these people. I only told him I will send his money as soon as I get to the States but he will never comprehend. He threatened to cancel my flight if I don’t pay him. I told him to still reserve it and that I will get back to him. My love, I have faith that the god who protected us this far will also help us on the remaining part of our journey. Please let your mind be at peace now because I already got what I came here to work for. My check is in my own hand and that is a guarantee that you will get all you have ever loaned me or will ever loan me. I mean I don’t expect you to panic now regardless of the amount I may need. The flight is only South African Rand, R17,468.00 ($2,257.03). I am supposed to pay $60 for taxi and $180 for the truck to move my equipments to the airport. This brings every thing to a sum of $2,497.03. Though I have a $1,980 deficit at the hotel but I can still beg the manager to allow me pay when I get over and I know he would listen. He seems the only reasonable person I know here. Please honey, I don’t want to remain here. No matter how hard this has become, just relax your mind, it will all end in a matter of hours when I arrive. My luggage is all packed. I only need to pay the agent and move my things to the airport. Thank you for your support right from the beginning till now and forever. I know we will never give up on each other. I want to touch you, hug you and feel your breath on me starting from tomorrow on. PLEASE ATTEND TO THIS QUICKLY!!! I wait for your call or email. Missing you already…. Your Hero,"
illegitime,"baby I can't stand not being with you and and you being so far away. I've been struggling with this for so long baby. I want u to know that you are with me' always, my thoughts are on you constantly baby and that will never change. Baby am in love with you so deep. Am desperate to feel your arms around me' baby. You are my sweet baby Girl, just need you to know how much I care. Missing you and loving you always xoxoxoxoxo"
illegitime,"Basically, all I do each business day is supervise the workers, monitor the jobs and make corrections and I have been doing this for more than one year. I know your mind is telling you it may be boring to do same thing each day (lol), but it’s never boring for I have the most interesting workers ever. We are like a large family and every one is always happy."
illegitime,"By the way, What kind of dates do u prefer?? Well as for me i prefer private dates, with my woman and myself alone. I guess i like the private moments when we can share intimate things. Talk about plans, desires, feelings. As I said before, I'm quite physical. I love to hug and touch and be touched. I love to show affection to my woman and i love it when she's very affectionate with me. I love women and i always desire to respect them. When i have been with a woman, i have never taken advantage of them unless they do took advantage of me. Even when they want me to be physical with them, I always want only to honor and respect them."
illegitime,"Can you tell me more about yourself??????. Well am really looking for a long term and serious relationship,I need a woman that will love me for whom i am,Make me happy again..Am also gonna show in a lot of caring ways in return,Am new on this dating stuff and i really hope i can make som,ething real with you and leave this internet stuff soon...."
illegitime,Could you please reply to this message and make me feel like the luckiest person in the world?
illegitime,"Darling, I lost life when I lost Mary; I found you and you brought me back alive. I am living once again, thank you so much. Even though I have succeeded in other areas of life, if I have not found you, I would still be like an unfortunate man. Love is all we need to stay alive for real. This morning, I am writing you from the top of my office table standing on my feet because I am supposed to be outside with the inspection team, but when I stood up to go, I could not, your thought in my mind logged on into my google account and here I am still writing.lol. Dear, if you have been loved in the past, know that that love is not enough, if you have been happy in the past, know that you didn’t get the dept of happiness you deserve, if you ever have been caress in your life, know that you haven’t got a clue, when all this inspection of a thing is finally completed and I step into my flight coming to you, prepare yourself to be loved above all women, prepare your mind to be the happiest woman on earth and prepare your life to be caressed like never before, I will spoil you with every thing honey. I wish I didn’t have to miss you. If only you could be with me always. I know I could never be any happier. But then again, I know that the day is now, when I will be able to spend my every waking moment with you. I even miss you when I am sleeping!"
illegitime,"Dear Hon, Good morning to you. Thank you so much for all your love, care and support. Today, I woke up beside you. I felt your touch, your breath, your early morning smile and kiss. I wish I didn’t have to miss you. If only you could be with me always. I know I could never be any happier. But then again, I know that tomorrow I will be able to spend my every waking moment with you. I even miss you when I am sleeping! I love you, babe. You are my now and ever, my only love, and I thank you for being so kind with my heart. Hopefully, in less than 48hrs, I won’t have to hate missing you. I’m going to the warehouse now to arrange for how my equipments would be transported to the airport. Then I will come back to the hotel room to relax again and prepare for the long 32h45mins journey. I will call you when I’m about leaving for the airport. Feeling you in my hands already (lol). Love Always,"
illegitime,"Dear, I am not afraid and I can never be. I am bold and proud of you, I love you for you, not for any particular reason because the love I have for you is unquestionable, true love indeed! Love and death are things one can not question because you can not say where, when or how. Love catches up with us and we find our-self in deep dept. I love you unconditionally my …… This is why I have never asked any particular question because I know it doesn’t matter any way, I am in love already, to stay and never let go no matter what we go through. I understand love hurts especially when one does not get equal love but our love will never hurt honey, I promise on my life. I swear by the day I was born, the day I shall die and the day I shall rise again, I will love you through the thick and thin. I will love you through eternity. I will be your shoulder if you ever need a shoulder to lean on. I will be there for you through all seasons, weather, condition and any situation. For you, I will fly with the angels just to protect and guide you from any kind of worries. I will be there and never leave. On my life, I swear! Please promise me you will never hurt me nor break my heart too. All I’m asking is equal love, a love that is unconditional, true love that lives even after death. That is all I’m asking honey or is it too much (lol). As far as our love is reciprocal, we will be happy together cos we will always understand each other, tolerate one another and endure in any kind of situation. Our life will be filled with so much joy and fulfillment of heart. We will never cry nor have any reason to. I love you ……!"
illegitime,"Dear, I love you! And I love you! You have done for me, what no other person can do. You have loved me the way no one can ever do. You have brought to me, a kind of happiness no one can ever bring. You have walked with me in the darkest night no one else could dare. You have crossed with me, the most dangerous bridge. You have shown me, a commitment no one else could ever show. You have proved beyond doubt the reason for me to wanting to wake up every day. You have said to me, the best words ever. I feel like someone in paradise as the King of Kings and you the Queen of Queens. To love you through eternity, is no doubt. Good morning greatest of lovers. It’s Ben waking you with a smile. I LOVE YOU!"
illegitime,"Dear, I think about you every second of every day. When I fall asleep, my dreams are about you. When I wake up, I look at the empty pillow next to me and wish you were there looking into my eyes. I wish I could tell you how I really feel. Dear I want a long term relationship and one that will last forever but now we have to take it slow and get to know more about each other better."
illegitime,"Dear, if you are placed in the midst of a million women and I am to pick, I know I will figure you out without the least mistake. If the whole water, the oceans and the seas on earth, together with the ones in heaven are joined together and turned into ink; and the whole trees in the forest are turned into pen and I am told to write how much I adore you, I will use all the ink and pen and still have more to write. If I am to count how much I treasure you with the stones on earth, I bet I will empty the earth and will have have more to count. Even when I die and I have the opportunity to make only one wish, I would still wish that we spend our eternal life together in heaven."
illegitime,"Dear, today was more brief as the professions would not discuss any further but concluded they won’t start any work until they have the first $40k in hand. I have no choice, I contacted Nelson immediately and glory be to God, he would help me with $15k with the $15k I have with me which means I would have $30k by tomorrow when Nelson sends the money. I also have a pure white gold wrist watch that I bought for $7k when I was in Dubai. I will take it to the pawn shop tomorrow and see what I can get on it. But even if I get the same $7k, I will still be looking for $3k. Who else do I turn to? I have thought over this again and again but what can I do? If I can tell a friend my problem and he listens and ready to help, why won’t I be able to share it with my own wife."
illegitime,"Dear, you bring to me a happiness no one else has before. You bring to me a love I have never known before. I could not imagine what my life would be like without you. I know that I don’t want to even imagine. You have touched my heart in ways no one could ever comprehend. I love being with you and I want to spend the rest of my life with you. My Wonderful angel there is nothing on this Earth that I could ever give you that would ever come close to how I feel about you. I want to be with you for the rest of your life, and I know you feel the same. If only you knew how much I want to stay in your life. Love Always,"
illegitime,"Dearest , I am in the middle of work and very busy now. You already make me feel like the luckiest man on earth. I will write you again first thing when I’m free cos I’ll be thinking and thinking of you all through. My dream is to travel to all the beautiful places and see all the wonders in the world with my woman. I can’t wait to be on the London eye side by side with my woman, to be in Paris to see my mother and all its beauty, in the gorgeous Sydney Australia, in the beautiful Bahamas, once again in Dubai to spend time together in my house (if I haven’t found a tenant before then) and the rest of the world. Meeting you and hopefully, starting a new life with you is the surest thing. Just be patient, I will be retired in only few weeks. Sending smiles~"
