alabel,message
legitime," Subject: 2- SURVEY/INFORMATION EMAIL 5-14- 01  Current Notes User:   To ensure that you experience a successful migration from Notes to Outlook,  it is necessary to gather individual user information prior to your date of  migration.  Please take a few minutes to completely fill out the following  survey. Double Click on document to put it in ""Edit"" mode. When you finish,  simply click on the 'Reply With History' button then hit 'Send'  Your survey  will automatically be sent to the Outlook 2000 Migration Mailbox.  Thank you.  	    "
legitime," Subject: 2- SURVEY/INFORMATION EMAIL  Current Notes User:   To ensure that you experience a successful migration from Notes to Outlook,  it is necessary to gather individual user information prior to your date of  migration.  Please take a few minutes to completely fill out the following  survey.  When you finish, simply click on the 'Reply' button then hit 'Send'   Your survey will automatically be sent to the Outlook 2000 Migration Mailbox.  Thank you.  Outlook 2000 Migration Team  ------------------------------------------------------------------------------ --------------------------------------------------------------  Full Name:          Login ID:    Extension:    Office Location:    What type of computer do you have?  (Desktop,  Laptop,  Both)    Do you have a PDA?  If yes, what type do you have:   (None, IPAQ, Palm Pilot,  Jornada)    Do you have permission to access anyone's Email/Calendar?      If yes, who?    Does anyone have permission to access your Email/Calendar?      If yes, who?    Are you responsible for updating anyone else's address book?      If yes, who?    Is anyone else responsible for updating your address book?      If yes, who?    Do you have access to a shared calendar?      If yes, which shared calendar?    Do you have any Distribution Groups that Messaging maintains for you (for  mass mailings)?      If yes, please list here:    Please list all Notes databases applications that you currently use:    In our efforts to plan the exact date/time of your migration, we also will  need to know:  What are your normal work hours?  From:      To:        Will you be out of the office in the near future for vacation, leave, etc?       If so, when?        From (MM/DD/YY):      To (MM/DD/YY):         "
legitime," Subject: 4-URGENT - OWA Please print this now. Current Notes User:  REASONS FOR USING OUTLOOK WEB ACCESS (OWA)  1. Once your mailbox has been migrated from Notes to Outlook, the Outlook  client will be configured on your computer. After migration of your mailbox, you will not be able to send or recieve mail  via Notes, and you will not be able to start using Outlook until it is  configured by the Outlook Migration team the morning after your mailbox is  migrated.  During this period, you can use Outlook Web Access (OWA) via your  web browser (Internet Explorer 5.0) to read and send mail.  PLEASE NOTE:  Your calendar entries, personal address book, journals, and  To-Do entries imported from Notes will not be available until the Outlook  client is configured on your desktop.  2. Remote access to your mailbox. After your Outlook client is configured, you can use Outlook Web Access (OWA)  for remote access to your mailbox.  PLEASE NOTE:  At this time, the OWA client is only accessible while  connecting to the Enron network (LAN).  There are future plans to make OWA  available from your home or when traveling abroad.  HOW TO ACCESS OUTLOOK WEB ACCESS (OWA)  Launch Internet Explorer 5.0, and in the address window type:   http://nahou-msowa01p/exchange/john.doe  Substitute ""john.doe"" with your first and last name, then click ENTER.  You  will be prompted with a sign in box as shown below.  Type in ""corp/your user  id"" for the user name and your NT password to logon to OWA and click OK.  You  will now be able to view your mailbox.  PLEASE NOTE:  There are some subtle differences in the functionality between  the Outlook and OWA clients.  You will not be able to do many of the things  in OWA that you can do in Outlook.  Below is a brief list of *some* of the  functions NOT available via OWA:  Features NOT available using OWA:  -  Tasks -  Journal -  Spell Checker -  Offline Use -  Printing Templates -  Reminders -  Timed Delivery -  Expiration -  Outlook Rules -  Voting, Message Flags and Message Recall -  Sharing Contacts with others -  Task Delegation -  Direct Resource Booking -  Personal Distribution Lists  QUESTIONS OR CONCERNS?  If you have questions or concerns using the OWA client, please contact the  Outlook 2000 question and answer Mailbox at:  Outlook.2000@enron.com  Otherwise, you may contact the Resolution Center at:  713-853-1411  Thank you,  Outlook 2000 Migration Team "
legitime," Subject: California Update 5/4/01  If you have any questions, please contact Kristin Walsh at (713) 853-9510.  Bridge Loan Financing Bills May Not Meet Their May 8th Deadline Due to Lack  of Support Sources report there will not be a vote regarding the authorization for the  bond issuance/bridge loan by the May 8th deadline.   Any possibility for a  deal has reportedly fallen apart.  According to sources, both the Republicans  and Democratic caucuses are turning against Davis.  The Democratic caucus is  reportedly ""unwilling to fight"" for Davis.  Many legislative Republicans and  Democrats reportedly do not trust Davis and express concern that, once the  bonds are issued to replenish the General Fund, Davis would ""double dip"" into  the fund.  Clearly there is a lack of good faith between the legislature and  the governor.  However, it is believed once Davis discloses the details of  the power contracts negotiated, a bond issuance will take place.   Additionally, some generator sources have reported that some of the long-term  power contracts (as opposed to those still in development) require that the  bond issuance happen by July 1, 2001.  If not, the state may be in breach of  contract.  Sources state that if the legislature does not pass the bridge  loan legislation by May 8th, having a bond issuance by July 1st will be very  difficult.  The Republicans were planning to offer an alternative plan whereby the state  would ""eat"" the $5 billion cost of power spent to date out of the General  Fund, thereby decreasing the amount of the bond issuance to approximately $8  billion.  However, the reportedly now are not  going to offer even this  concession.  Sources report that the Republicans intend to hold out for full  disclosure of the governor's plan for handling the crisis, including the  details and terms of all long-term contracts he has negotiated, before they  will support the bond issuance to go forward.  Currently there are two bills dealing  with the bridge  loan; AB 8X and AB  31X.  AB 8X authorizes the DWR to sell up to $10 billion in bonds.  This bill  passed the Senate in March, but has stalled in the Assembly due to a lack of  Republican support.  AB 31X deals with energy conservation programs for  community college districts.  However, sources report this bill may be  amended to include language relevant to the bond sale by Senator Bowen,  currently in AB 8X.  Senator  Bowen's language states that the state should  get paid before the utilities from rate payments (which, if passed, would be  likely to cause a SoCal  bankruptcy).   According to sources close to the Republicans in  the legislature,  Republicans do not believe there should be a bridge loan due to money  available in the General Fund.  For instance, Tony  Strickland has stated  that only 1/2 of the bonds (or approximately $5 billion)  should be issued.   Other Republicans reportedly do not support issuing any  bonds.  The  Republicans intend to bring this up in debate on  Monday.  Additionally,  Lehman Brothers reportedly also feels that a  bridge loan is unnecessary and  there are some indications that Lehman may  back out of the bridge loan.  Bill SB 6X Passed the Senate Yesterday, but Little Can be Done at This Time The Senate passed SB 6X yesterday, which authorizes $5  billion to create the  California Consumer Power and Conservation  Authority.    The $5 billion  authorized under SB 6X is not the  same as the $5 billion that must be  authorized by the legislature to pay for  power already purchased, or the  additional amount of bonds that must be authorized to pay for purchasing  power going forward.  Again, the Republicans are not in support of these  authorizations.  Without the details of the long-term power contracts the  governor has  negotiated, the Republicans do not know what the final bond  amount is that must  be issued and that taxpayers will have to pay to  support.   No further action can be taken regarding the implementation of  SB  6X until it is clarified how and when the state and the utilities get paid   for purchasing power.    Also, there is no staff, defined purpose, etc. for   the California Public Power and Conservation Authority.  However, this can   be considered a victory for consumer advocates, who began promoting this  idea  earlier in the crisis.  SoCal Edison and Bankruptcy At this point, two events would be likely to trigger a SoCal bankruptcy.  The  first would be a legislative rejection of the MOU between SoCal and the  governor.  The specified deadline for legislative approval of the MOU is  August 15th, however, some decision will likely be made earlier.  According  to sources, the state has yet to sign the MOU with SoCal, though SoCal has  signed it.  The Republicans are against the MOU in its current form and Davis  and the Senate lack the votes needed to pass.  If the legislature indicates  that it will not pas the MOU, SoCal would likely file for voluntary  bankruptcy (or its creditor - involuntary) due to the lack operating cash.    The second likely triggering event, which is linked directly to the bond  issuance, would be an effort by Senator Bowen to amend SB 31X (bridge loan)  stating that the DWR would received 100% of its payments from ratepayers,  then the utilities would receive the residual amount.  In other words, the  state will get paid before the utilities.  If this language is included and  passed by the legislature, it appears likely that SoCal will likely file for  bankruptcy.  SoCal is urging the legislature to pay both the utilities and  the DWR proportionately from rate payments.  "
legitime," Subject: Comments on Order 637 Compliance Filings  FYI  Attached are initial comments of ENA which will be filed Monday in the Order  637 Compliance Filings of the indicated pipelines.  (Columbia is Columbia  Gas.)  For all other pipelines on the priority list, we filed plain  interventions. "
legitime," Subject: Daily Duties       Phillip,           We have been working on different apartments today and having to listen to different, people about what Mary is saying should i be worried? ants seem to be invading my apartment.You got my other fax's Wade is working on the bulletin board that I need up so that I can let tenants know about what is going on.Gave #25 a notice about having to many people staying in that apt and that problem has been resolved.Also I have a tenant in #29 that is complaining about #28 using fowl language.I sent #28 a lease violation we will see how that goes                                                  call you tomorrow                                           Thanx Lucy ________________________________________________________________________ Get Your Private, Free E-mail from MSN Hotmail at http://www.hotmail.com  "
legitime," Subject: ENA Management Committee   This is a reminder !!!!!  There will be a Friday Meeting August 18, 2000.   This meeting replaces the every Friday Meeting and will be held every other  Friday.  If you have any questions or conflicts, please feel free to call me (3-0643)  or Bev (3-7857).  Thanks,  Kay 3-0643"
legitime," Subject: Gas Transportation Market Intelligence  										Capacity Shopper: Learn about capacity release that is posted to bid. Pick up  some transport at a good price or explore what releases are out there....it  can affect gas prices! 										Daily Activity Reports: Check out the deals that were done! What did your  competitors pick up, and how do their deals match up against yours? This  offers you better market intelligence! 										System Notices: Have System Notices delivered to your desk. Don't be the last  one to learn about an OFO because you were busy doing something else! 										 										[IMAGE] 										 										Capacity Shopper And Daily Activity Reports 										Have Improved Formats 										 										You choose the pipelines you want and we'll keep you posted via email on all  the details!  										Check out this example of a Daily Activity Report. 										 										Coming Soon: 										A Statistical Snapshot on Capacity Release 										 										 										Don't miss this member-only opportunity to see a quick snapshot of the  activity on all 48 interstate gas pipelines. 												 											This message has been sent to a select group of Industry Professionals, if  you do not wish to receive future notices, please Reply to this e-mail with  ""Remove"" in the subject line.	 								Copyright 2000 - CapacityCenter.com, Inc. - ALL RIGHTS RESERVED				  "
legitime," Subject: Instructions for FERC Meetings  Mr. Allen -   Per our phone conversation, please see the instructions below to get access  to view FERC meetings.  Please advise if there are any problems, questions or  concerns.  As long as you are configured to receive Real Video, you should be able to  access the FERC meeting this Wednesday, November 8.  The instructions are  below.  Here is the URL address for the Capitol Connection.  You should be able to  simply click on this URL below and it should come up for you.  (This is  assuming your computer is configured for Real Video/Audio).  We will pay for  the annual contract and bill your cost centers.  You are connected for tomorrow as long as you have access to Real Video.  http://www.capitolconnection.gmu.edu/ "
legitime," Subject: Just Released! Exclusive new animation from Stan Lee  Dear Phillip,   7th Portal is a super hero action/adventure, featuring a global band  of teenage game testers who get pulled into a parallel universe  (through the 7th Portal) created through a warp in the Internet. The  fate of the earth and the universe is in their hands as they fight  Mongorr the Merciful -- the evil force in the universe.   The legendary Stan Lee, creator of Spiderman and the Incredible Hulk,  brings us ""Let the Game Begin,"" episode #1 of 7th Portal -- a new  series exclusively on shockwave.com.   - the shockwave.com team   ===================== Advertisement =====================  Don't miss RollingStone.com! Watch Daily Music News. Download MP3s.  Read album reviews. Get the scoop on 1000s of artists, including  exclusive photos, bios, song clips & links. Win great prizes & MORE.  http://ads07.focalink.com/SmartBanner/page?16573.37-%n ===================== Advertisement =====================   ~~~~~~~~~~~~~~~~~~~~~~~~  Unsubscribe Instructions  ~~~~~~~~~~~~~~~~~~~~~~~~  Sure you want to unsubscribe and stop receiving E-mail from us? All  right... click here:  http://shockwave1.m0.net/m/u/shk/s.asp?e=pallen%40enron.com "
legitime," Subject: Large Deal Alert  To make a long story short.  Williams is long 4000MW of tolling in SP15 (SoCal )  for 20 years (I know I  did the deal) on Tuesday afternoon, Williams sold 1000 MW to Merrill Lynch for the  remaining life (now 18 years)  Merrill is short fixed price gas at So Cal border  up to 250,000MMBtu a day  and long SP15 power (1000 MW) a day.  heat rate 10,500  SoCal Border plus $0.50.  I'm not sure if MRL has just brokered this deal or is warehousing it.  For what its worth........ "
legitime," Subject: PIRA's California/Southwest Gas Pipeline Study  Did any of you order this JEn Subject: PIRA's California/Southwest Gas Pipeline Study  PIRA focuses on the  California/Southwest Region in its study of Natural Ga= s=20 Pipeline  Infrastructure  PIRA  Energy Group announces the continuation of its new multi-client study= ,=20 The  Price of Reliability: The Value and Strategy of Gas  Transportation.  The Price of Reliability, delivered in 6  parts (with each part representin= g=20 a discrete North American region), offers  insights into the changes and=20 developments in the North American natural gas  pipeline infrastructure. Th= e=20 updated prospectus, which is attached in PDF and  Word files, outlines PIRA= 's=20 approach and methodology, study deliverables  and?release dates.  This note  is to inform you that PIRA has commenced its study of the third= =20 region:  California & the Southwest. As in all regions, this  study begins= =20 with a fundamental view of gas flows in the U.S. and Canada.  Pipelines in= =20 this region (covering CA, NV, AZ, NM) will be discussed in greater  detail= =20 within the North American context. Then we turn to the value of =20 transportation at the following three major pricing points with an assessme= nt=20 of  the primary market (firm), secondary market (basis) and asset market:  ??????1) Southern  California border (Topock) ??????2) San Juan  Basin ??????3) Permian  Basin (Waha)?  The California/SW region=01,s  workshop =01* a key element of the service = =01* will=20 take place on March 20, 2000,at 8:30 AM, at the Arizona Biltmore Hotel in = =20 Phoenix.?For those of you joining  us, a?discounted  block  of rooms is bei= ng=20 held through February 25.  The attached prospectus explains the various  options for subscribing.?Plea= se=20 note  two key issues in regards to your subscribing options:?One, there is = a=20 10% savings for  PIRA retainer clients who order before February 25, 2000;= =20 and?two, there are discounts for  purchasing?more than one  region.  If you have any questions, please do not hesitate to  contact me.  Sincerely,  "
legitime," Subject: RE: Receipt of Team Selection Form - Executive Impact & Influence  Program We have not received your completed Team Selection information.  It is imperative that we receive your team's information (email, phone number, office) asap.  We cannot start your administration without this information, and your raters will have less time to provide feedback for you.  Thank you for your assistance.  Christi  Hi Phillip.  We appreciate your prompt attention and completing the Team Selection information.  Ideally, we needed to receive your team of raters on the Team Selection form we sent you.  The information needed is then easily transferred into the database directly from that Excel spreadsheet.  If you do not have the ability to complete that form, inserting what you listed below, we still require additional information.  We need each person's email address.  Without the email address, we cannot email them their internet link and ID to provide feedback for you, nor can we send them an automatic reminder via email.  It would also be good to have each person's phone number, in the event we need to reach them.  So, we do need to receive that complete TS Excel spreadsheet, or if you need to instead, provide the needed information via email. "
legitime," Subject: Re: SW Gas    Mike McDonald and I met with SW Gas this morning.  They were polite regarding  asset management and procurement function outsourcing and are willing to  listen to a proposal.  However, they are very interested in weather hedges to  protect throughput related earnings.  We are pursuing a confidentiality  agreement with them to facilitate the sharing of information that will enable  us to develop proposals.  Our pitch was based upon enhancing shareholder  value by outsourcing a non-profit and costly function (procurement) and by  reducing the volatility of their earnings by managing throughput via a  weather product.  As to your other question.  We have yet to identify or pursue other  candidates; however, Mike McDonald and I are developing a coverage strategy  to ensure that we meet with all potential entities and investigate our  opportunities.  We met with 8 entities this week (7 Municipals and SWG) as we  implement our strategy in California.  Are there any entities that you think would be interested in an asset  management deal that we should approach?  Otherwise, we intend to  systematically identify and work through all the candidates.   Laird "
legitime," Subject: Re: This morning's Commission meeting delayed    Phil,  I suspect that discussions/negotiations are taking place behind closed  doors ""in smoke filled rooms"", if not directly between Commissioners then  among FERC staffers.  Never say never, but I think it is highly unlikely that  the final order will contain a fixed price cap.  I base this belief in large  part on what I heard at a luncheon I attended yesterday afternoon at which  the keynote speaker was FERC Chairman Curt Hebert.  Although the Chairman  began his presentation by expressly stating that he would not comment or  answer questions on pending proceedings before the Commission, Hebert had  some enlightening comments which relate to price caps:  Price caps are almost never the right answer Price Caps will have the effect of prolonging shortages Competitive choices for consumers is the right answer Any solution, however short term, that does not increase supply or reduce  demand, is not acceptable Eight out of eleven western Governors oppose price caps, in that they would  export California's problems to the West  This is the latest intelligence I have on the matter, and it's a pretty  strong anti- price cap position.  Of course, Hebert is just one Commissioner  out of 3 currently on the Commission, but he controls the meeting agenda and  if the draft order is not to his liking, the item could be bumped off the  agenda.  Hope this info helps.  Ray Subject: Re: This morning's Commission meeting delayed    Are there behind closed doors discussions being held prior to the meeting?   Is there the potential for a surprise announcement of some sort of fixed  price gas or power cap once the open meeting finally happens? "
legitime," Subject: Re: Western Wholesale Activities - Gas & Power Conf. Call Privileged & Confidential Communication Attorney-Client Communication and Attorney Work Product Privileges Asserted  Please forward to anyone on your team that wants updates on Western wholesale  matters (should also give you an opportunity to raise state matters if you  want to discuss).  Jim  Subject: Re: Western Wholesale Activities - Gas & Power Conf. Call Privileged & Confidential Communication Attorney-Client Communication and Attorney Work Product Privileges Asserted  Attached is the table of the on-going FERC issues and proceedings updated for  use on tomorrow's conference call.  It is available to all team members on  the O drive. Please feel free to revise/add to/ update this table as  appropriate.  Proposed agenda for tomorrow:  Power-  Discussion of FERC market monitoring and mitigation order in  EL00-95-12 and review of upcoming filings Gas- Response to subpoenas of SoCal Edison in RP00-241 and upcoming items Misc.  I will be unable to participate in the call tomorrow as I will be attending  the Senate Energy and Resource Committee Hearing on the elements of the FERC  market monitoring and mitigation order. "
legitime," Subject: Receipt of Team Selection Form - Executive Impact & Influence Program  Hi Phillip.  We appreciate your prompt attention and completing the Team Selection information.  Ideally, we needed to receive your team of raters on the Team Selection form we sent you.  The information needed is then easily transferred into the database directly from that Excel spreadsheet.  If you do not have the ability to complete that form, inserting what you listed below, we still require additional information.  We need each person's email address.  Without the email address, we cannot email them their internet link and ID to provide feedback for you, nor can we send them an automatic reminder via email.  It would also be good to have each person's phone number, in the event we need to reach them.  So, we do need to receive that complete TS Excel spreadsheet, or if you need to instead, provide the needed information via email.  Thank you for your assistance Phillip. "
legitime," Subject: Request from Steve Kean  Phillip,  I got this request.  On the gas side, I think Kean/Lay need an update to a  table you prepared for me a few months ago, which I've attached..  Can you  oblige?  Thanks,  Alan Comnes   Janel Guerrero@ENRON 04/27/2001 12:44 PM To: Alan Comnes/PDX/ECT@ECT, Jeff Dasovich/NA/Enron@Enron cc: Paul Kaufman/PDX/ECT@ECT, Richard Shapiro/NA/Enron@Enron   Subject: Request from Steve Kean  Alan,  Steve has asked that you update the power point below so that it reflects all  of the ""stupid regulatory/legislative decisions"" since the beginning of the  year.  Ken wants to have this updated chart in his briefing book for next  week's ""Ken Lay Tour"" to CA.    He also wants a forward price curve for both gas and power in CA.  Can we get  these three documents by Monday afternoon?      "
